{
  "schema_version": "5.0",
  "baseline_id": "wan22_ti2v_5b_lora_r32_symbol_value_cross_attention_v1",
  "baseline_version": "1.0.0",
  "implementation": {
    "kind": "managed",
    "driver": "driver.py",
    "fingerprint_paths": ["adapter.py", "quantity_registry.json"]
  },
  "description": "WAN2.2-TI2V-5B with DiT LoRA and trainable UMT5-word-space symbol/value tokens injected into contextual text by bottleneck cross-attention.",
  "supported_scenes": [
    "pendulum",
    "free_fall",
    "collision_1d",
    "inclined_plane_slide",
    "uniform_circular_motion",
    "parabolic_motion",
    "push_bottle",
    "vertical_spring_oscillator"
  ],
  "capabilities": {
    "task_families": ["finetune_eval"],
    "generation_modes": ["i2v"],
    "train": false,
    "finetune": true,
    "generate": true
  },
  "input_policy": {
    "schema_version": "1.0",
    "case_view": "conditionable_case_v1",
    "text": {"source": "case.text.prompt", "usage": "required"},
    "physics": {
      "source": "case.physics",
      "usage": "required",
      "representations": ["symbol_value_cross_attention_v1"]
    }
  },
  "model": {
    "base_model": "WAN2.2-TI2V-5B",
    "initialization": {
      "dit_lora": "random",
      "symbol_value_conditioner": "random"
    },
    "symbol_value_conditioner": {
      "schema_version": "1.0",
      "injection_stage": "post_frozen_umt5_pre_dit_cross_attention",
      "symbol_embedding": "frozen_umt5_subword_mean",
      "fusion": "layer_norm_symbol_plus_value",
      "text_hidden_size": 4096,
      "numeric_feature_size": 8,
      "numeric_hidden_size": 256,
      "numeric_embedding_size": 256,
      "dimension_size": 7,
      "dimension_hidden_size": 128,
      "dimension_embedding_size": 128,
      "unit_count": 9,
      "unit_embedding_size": 64,
      "value_fusion_hidden_size": 768,
      "attention_hidden_size": 512,
      "attention_heads": 8,
      "dropout": 0.0,
      "residual_gate_init": 0.1,
      "normalization": "layer_norm",
      "activation": "silu"
    }
  },
  "runtime": {
    "project_root": ".",
    "python": "python",
    "model_base": "models",
    "cuda_visible_devices": "0",
    "accelerate_config": null,
    "diffsynth_commit": "fb337fbb90945ff829de69dbd44ded618f73e889"
  },
  "adapter": {
    "kind": "python",
    "entrypoint": "adapter.py",
    "cache_policy": "content_addressed_shared_immutable",
    "config": {
      "preset": "standard_i2v_v1",
      "first_frame_policy": "require_asset",
      "cache_policy": "content_addressed_shared_immutable",
      "quantity_registry": "quantity_registry.json",
      "spatial": {
        "type": "wan22_spatial_v1",
        "scene_profiles": {
          "pendulum": {"name": "portrait", "width": 480, "height": 832},
          "free_fall": {"name": "portrait", "width": 480, "height": 832},
          "uniform_circular_motion": {"name": "portrait", "width": 480, "height": 832},
          "parabolic_motion": {"name": "portrait", "width": 480, "height": 832},
          "push_bottle": {"name": "portrait", "width": 480, "height": 832},
          "collision_1d": {"name": "landscape", "width": 832, "height": 480},
          "inclined_plane_slide": {"name": "landscape", "width": 832, "height": 480},
          "vertical_spring_oscillator": {"name": "portrait", "width": 480, "height": 832}
        }
      },
      "temporal": {
        "type": "wan22_temporal_v1",
        "fps": 24,
        "max_frames": 121,
        "min_frames": 5,
        "valid_frame_rule": "4n+1",
        "policy": "baseline-native maximum length; preserve valid 4n+1 frame counts"
      }
    }
  },
  "trainer": {
    "type": "diffsynth_flowmatch_lora_symbol_value_cross_attention_v1",
    "config": {
      "algorithm": "FlowMatch SFT + DiT LoRA + symbol-value conditioner",
      "rank": 32,
      "target_modules": "q,k,v,o,ffn.0,ffn.2",
      "learning_rate": 0.0001,
      "dataset_repeat": 1,
      "num_epochs": 2,
      "save_steps": 273,
      "scene_balancing": "oversample_each_scene_to_largest_world_aligned",
      "gradient_accumulation": 1,
      "num_workers": 4,
      "seed": 42,
      "precision": "bf16",
      "conditioner_precision": "fp32",
      "gradient_checkpointing": true,
      "optimizer": "AdamW",
      "scheduler": "ConstantLR",
      "weight_decay": 0.01,
      "save_optimizer_state": true
    }
  },
  "runner": {
    "type": "wan22_ti2v_symbol_value_cross_attention_v1",
    "config": {
      "num_inference_steps": 50,
      "cfg_scale": 5.0,
      "lora_alpha": 1.0,
      "tiled": true,
      "quality": 5,
      "negative_prompt": "camera shake, changing apparatus identity, discontinuous motion, flicker, blur, text, watermark, low quality"
    }
  }
}
